{
  "schema_version": "1.0",
  "id": "grounded-15",
  "provenance": "由2026-09-21用户附件提示词重建；细节拍时间、阶段状态及能力结束条件是本项目编辑补充，不是遗失原计划的恢复；未生成视频。 本次按用户要求将A的兵器改为木杖，同步修订攻防机制、材质反馈、声音和连续性；保留原时长、镜头、B的短刀及结尾；只交付文本，未实际生成。",
  "template": "grounded",
  "duration": 15,
  "aspect_ratio": "16:9",
  "generation": "single",
  "camera_mode": "one-take",
  "headers": {
    "goal": "15秒，16:9，单个生成任务中的完整片段。一个连续长镜头，不切镜、不跳切、不以黑场或遮挡伪装剪辑。\n写实中式武侠动作，正常速度，真实重心和衣料重量；全程无仙术、无能量冲击、无夸张飞跃。\n结尾要求：14.4秒前A已从空隙通过并在安全距离转身警戒；B留在碎石带旁，短刀掉在其身侧。最后0.6秒保留呼吸。",
    "cast": "A 青衣行者：成年男性，黑发整齐束起，青灰色束袖长衣、深色里裤与靴子；面部有自然肤质，衣料不发塑料光；兵器：约1.2米长的实心硬木杖，圆钝两端、自然木纹、无金属包头、无刃口与护手；持械：右手，握在杖身后段，握位与出杖长度保持一致，左手留在身前辅助平衡，不换手。目标：突破道路阻挡后停在安全距离，不继续追击。表演基调：警惕克制，视线关注对方身体与持械手。\r\nB 黑衣拦路者：成年男性，黑褐劲装、暗红腰带、深色靴子；固定发型和面貌；兵器：短刀；持械：右手。目标：拦住A不让通过。表演基调：前段积极压迫，失位后急促戒备。",
    "scene": "城外宽阔夯土官道，两侧竹林后退留出空间；日间中性自然光，远处朴素石桥，地面有少量浮尘和一小块碎石带。\n空间锚点：远处石桥；道路北缘碎石带\n机位关系：主要机位保持场景南侧，人物位置变化通过可见移动完成\n独立测试片，不写入任何已有剧集正史；人物与兵器保持一致，不新增角色；能力与空间规则以本方案为上限\n不使用幻想能力；效果只来自可见人物动作和环境作用。",
    "budget": "开头0.2秒和结尾0.6秒的余量已包含在总长内，不额外延长。目标结果在14.4秒前到达；余量保留自然运动，不机械定格。",
    "continuity": "所有动作从上一动作结束状态开始。保持人物面貌、发型、服装结构、兵器形状和持械手。身体、兵器与受力反馈按时间先后发生；没有因果的瞬移、换脸、换武器和环境复位不出现。\n特效不能始终遮挡关键攻防；节拍时点是导演目标，不通过字幕展示。人物不无故摆姿势，不新增旁观者。声音来自对应画面事件。 A的木杖始终由右手握持，长度、木纹、握位和圆钝端头保持一致；刀与木的交接只产生木质闷响、短促刮擦和接触浅痕，不产生金属火花或金属对撞长鸣；木杖不变成利刃，不使用护手钩挂；已出现的浅痕持续保留，木杖不折断、不穿透人体。"
  },
  "rules": {
    "fantasy": false,
    "max_scale": "person"
  },
  "timing": {
    "lead_in": 0.2,
    "tail_out": 0.6,
    "result_at": 14.4
  },
  "anchors": [
    "远处石桥",
    "道路北缘碎石带"
  ],
  "cast": [
    {
      "id": "A",
      "description": "青衣行者：成年男性，黑发整齐束起，青灰色束袖长衣、深色里裤与靴子；面部有自然肤质，衣料不发塑料光",
      "goal": "突破道路阻挡后停在安全距离，不继续追击",
      "prop": "约1.2米长的实心硬木杖，圆钝两端、自然木纹、无金属包头、无刃口与护手",
      "hand": "右手"
    },
    {
      "id": "B",
      "description": "黑衣拦路者：成年男性，黑褐劲装、暗红腰带、深色靴子；固定发型和面貌",
      "goal": "拦住A不让通过",
      "prop": "短刀",
      "hand": "右手"
    }
  ],
  "abilities": [],
  "references": [],
  "initial_state": {
    "A": "官道西侧，面向B，右手握木杖后段，杖身斜置身前准备格挡，左手辅助平衡",
    "B": "官道中部，面向A，右手短刀准备前压",
    "environment": "初始场景完整；远处石桥；道路北缘碎石带",
    "camera_side": "南侧"
  },
  "beats": [
    {
      "id": "B01",
      "start": 0.0,
      "end": 2,
      "intent": "双方紧张，B暂时掌握主动",
      "actors": {
        "A": {
          "action": "开头0.2秒保持警戒呼吸；随后向前一步，右手抬起斜置的木杖，用杖身迎上挥来的短刀并向外偏转刀路，接触后脚步轻退，左手辅助平衡",
          "performance": "盯住短刀和持刀手，接触后短呼气"
        },
        "B": {
          "action": "向A逼近，右手短刀挥向A上身，在杖身处发生一次清楚接触后被偏向外侧",
          "performance": "眉眼压低，注意A上半身"
        }
      },
      "emotion": "双方紧张，B暂时掌握主动",
      "camera": {
        "shot_id": "S01",
        "transition": "start",
        "side": "南侧",
        "path": "从侧面双人中全景，从南侧开始平稳横移",
        "axis_bridge": ""
      },
      "vfx": "刀与木杖接触处留下浅痕，不产生火花；只见脚步扬起的少量浮尘",
      "environment": "第一次交接带起少量浮尘，双方仍在官道",
      "sound": "一次刀碰木的短促闷响和轻微刮擦，衣料与脚步声。无台词与背景音乐。",
      "ability_ids": [],
      "before": {
        "A": "官道西侧，面向B，右手握木杖后段，杖身斜置身前准备格挡，左手辅助平衡",
        "B": "官道中部，面向A，右手短刀准备前压",
        "environment": "初始场景完整；远处石桥；道路北缘碎石带",
        "camera_side": "南侧"
      },
      "after": {
        "A": "接刀后轻退，右手木杖保持可见，杖身留浅痕，左手辅助平衡",
        "B": "向A逼近，右手短刀完成接触并被偏向外侧",
        "environment": "初始场景完整；远处石桥；道路北缘碎石带；第一次交接带起少量浮尘，双方仍在官道",
        "camera_side": "南侧"
      }
    },
    {
      "id": "B02",
      "start": 2,
      "end": 4.5,
      "intent": "双方紧张，B暂时掌握主动",
      "actors": {
        "A": {
          "action": "边挡边沿道路后退两步，右手以木杖作两次短幅侧拨，每次刀路被拨开后收回木杖至身前并恢复重心，不大幅抡转",
          "performance": "退步时加快呼吸，眼睛不离对手"
        },
        "B": {
          "action": "连续跟进，右手短刀分两次进攻，刀路先后被木杖拨开，第二次动作让身体更靠近道路北侧",
          "performance": "前压时呼吸逐渐加重，追随A肩部"
        }
      },
      "emotion": "双方紧张，B暂时掌握主动",
      "camera": {
        "shot_id": "S01",
        "transition": "continuous",
        "side": "南侧",
        "path": "连续双人中全景，连续横向跟随，不改变机位侧",
        "axis_bridge": ""
      },
      "vfx": "刀碰木只增加少量浅痕，不产生火花、光线或夸张木屑",
      "environment": "A后退擦痕保留，B逐步靠近北缘碎石带",
      "sound": "两次分开的刀碰木闷响与短促刮擦，伴随退步声。无台词与背景音乐。",
      "ability_ids": [],
      "before": {
        "A": "接刀后轻退，右手木杖保持可见，杖身留浅痕，左手辅助平衡",
        "B": "向A逼近，右手短刀完成接触并被偏向外侧",
        "environment": "初始场景完整；远处石桥；道路北缘碎石带；第一次交接带起少量浮尘，双方仍在官道",
        "camera_side": "南侧"
      },
      "after": {
        "A": "道路中部站住，右手木杖已收回身前，既有浅痕保留",
        "B": "北侧附近继续前压，短刀在身前",
        "environment": "初始场景完整；远处石桥；道路北缘碎石带；第一次交接带起少量浮尘，双方仍在官道；A后退擦痕保留，B逐步靠近北缘碎石带",
        "camera_side": "南侧"
      }
    },
    {
      "id": "B03",
      "start": 4.5,
      "end": 7.0,
      "intent": "A从被动紧张转向集中判断",
      "actors": {
        "A": {
          "action": "双脚站稳，略侧身避开刀的正面来路，右手用斜置杖身作一次短促格挡并将刀路带向身外，木杖随后收回身前，把视线从刀尖转到对方重心",
          "performance": "抿唇后呼气，目光从刀尖转向对方重心"
        },
        "B": {
          "action": "短刀被木杖挡向身外，前进一步后需要收回身体",
          "performance": "目光短追A侧移，收回身体时呼吸加重"
        }
      },
      "emotion": "A从被动紧张转向集中判断",
      "camera": {
        "shot_id": "S01",
        "transition": "continuous",
        "side": "南侧",
        "path": "连续双人中全景，连续小幅向前跟进，双脚不出画",
        "axis_bridge": ""
      },
      "vfx": "没有新增效果，重点是接触与身体停顿",
      "environment": "衣摆迟于身体回落，既有尘土继续飘动",
      "sound": "一次刀碰木的闷响和刮擦之后短暂露出呼吸声。无台词与背景音乐。",
      "ability_ids": [],
      "before": {
        "A": "道路中部站住，右手木杖已收回身前，既有浅痕保留",
        "B": "北侧附近继续前压，短刀在身前",
        "environment": "初始场景完整；远处石桥；道路北缘碎石带；第一次交接带起少量浮尘，双方仍在官道；A后退擦痕保留，B逐步靠近北缘碎石带",
        "camera_side": "南侧"
      },
      "after": {
        "A": "道路中部稳定侧身，右手木杖收在身前可见，既有浅痕保留",
        "B": "北侧靠近碎石，前压后回收",
        "environment": "初始场景完整；远处石桥；道路北缘碎石带；第一次交接带起少量浮尘，双方仍在官道；A后退擦痕保留，B逐步靠近北缘碎石带；衣摆迟于身体回落，既有尘土继续飘动",
        "camera_side": "南侧"
      }
    },
    {
      "id": "B04",
      "start": 7.0,
      "end": 10,
      "intent": "A夺回空间，B由压迫转为失位戒备",
      "actors": {
        "A": {
          "action": "迈一步向B身前推出木杖圆钝前端，迫使B用短刀挡开并实际后退；杖端受挡偏开后立即收回，不穿刺身体，不加额外空翻",
          "performance": "迈步时锁定B支撑脚与道路空隙"
        },
        "B": {
          "action": "右手短刀侧挡推来的木杖，身体实际后退，脚步进入碎石带",
          "performance": "退步时快速看向脚下碎石，身体努力恢复平衡"
        }
      },
      "emotion": "A夺回空间，B由压迫转为失位戒备",
      "camera": {
        "shot_id": "S01",
        "transition": "continuous",
        "side": "南侧",
        "path": "连续双人中全景，连续横移，随双方移动自然调整构图",
        "axis_bridge": ""
      },
      "vfx": "刀与木杖接触不产生火花，身体运动保持清楚",
      "environment": "B脚步进入碎石带，碎石因落脚滚动",
      "sound": "一次刀碰木的闷响、脚步与碎石移动声。无台词与背景音乐。",
      "ability_ids": [],
      "before": {
        "A": "道路中部稳定侧身，右手木杖收在身前可见，既有浅痕保留",
        "B": "北侧靠近碎石，前压后回收",
        "environment": "初始场景完整；远处石桥；道路北缘碎石带；第一次交接带起少量浮尘，双方仍在官道；A后退擦痕保留，B逐步靠近北缘碎石带；衣摆迟于身体回落，既有尘土继续飘动",
        "camera_side": "南侧"
      },
      "after": {
        "A": "道路中部前进一步，右手木杖收回身前，既有浅痕保留",
        "B": "实际后退至北缘碎石带，右手仍持短刀",
        "environment": "初始场景完整；远处石桥；道路北缘碎石带；第一次交接带起少量浮尘，双方仍在官道；A后退擦痕保留，B逐步靠近北缘碎石带；衣摆迟于身体回落，既有尘土继续飘动；B脚步进入碎石带，碎石因落脚滚动",
        "camera_side": "南侧"
      }
    },
    {
      "id": "B05",
      "start": 10,
      "end": 12.5,
      "intent": "A夺回空间，B由压迫转为失位戒备",
      "actors": {
        "A": {
          "action": "先以杖身短幅侧拨B最后一次前探的短刀，刀路偏开后用木杖前段侧面作一次短促拨击，触及B持刀手腕外侧；接触后立即收杖，看见B失位和松手便停止攻击",
          "performance": "目光从落刀回到B，呼气后停手警戒"
        },
        "B": {
          "action": "脚下碎石滚动，退到边缘时重心失稳；短刀先被木杖拨开，随后右手腕外侧受到杖身短促拨击，手腕偏转、手指松开，短刀脱手落在身侧，身体一膝触地，左手撑地",
          "performance": "短暂惊讶，眼睛追向落刀，手掌准备支撑"
        }
      },
      "emotion": "A夺回空间，B由压迫转为失位戒备",
      "camera": {
        "shot_id": "S01",
        "transition": "continuous",
        "side": "南侧",
        "path": "连续双人中全景，连续后退少许，让落刀过程完整入画",
        "axis_bridge": ""
      },
      "vfx": "木杖接触不产生火花；不出现伤口、骨折或能量波，落刀只带起一点尘土",
      "environment": "短刀松手到落地轨迹可见，掉落点留在B身侧",
      "sound": "一次刀碰木的闷响、一次杖身触及手腕的轻闷声、短刀落地与B急促呼吸。无台词与背景音乐。",
      "ability_ids": [],
      "before": {
        "A": "道路中部前进一步，右手木杖收回身前，既有浅痕保留",
        "B": "实际后退至北缘碎石带，右手仍持短刀",
        "environment": "初始场景完整；远处石桥；道路北缘碎石带；第一次交接带起少量浮尘，双方仍在官道；A后退擦痕保留，B逐步靠近北缘碎石带；衣摆迟于身体回落，既有尘土继续飘动；B脚步进入碎石带，碎石因落脚滚动",
        "camera_side": "南侧"
      },
      "after": {
        "A": "通路前停止攻击，右手木杖保持警戒，既有浅痕保留",
        "B": "北侧一膝触地，右手空，刀在身侧地面",
        "environment": "初始场景完整；远处石桥；道路北缘碎石带；第一次交接带起少量浮尘，双方仍在官道；A后退擦痕保留，B逐步靠近北缘碎石带；衣摆迟于身体回落，既有尘土继续飘动；B脚步进入碎石带，碎石因落脚滚动；短刀松手到落地轨迹可见，掉落点留在B身侧",
        "camera_side": "南侧"
      }
    },
    {
      "id": "B06",
      "start": 12.5,
      "end": 15.0,
      "intent": "目标完成后的克制停手",
      "actors": {
        "A": {
          "action": "从B空出的道路一侧通过，两步后转身，14.4秒前站到安全距离，木杖前端略放低；最后0.6秒保留呼吸和自然身体微动",
          "performance": "肩部稍松，转身后仍看B，胸口起伏"
        },
        "B": {
          "action": "留在道路边缘抬头看A，没有立即捡刀发动新回合",
          "performance": "目光追着A，呼吸更快，手掌支撑身体"
        }
      },
      "emotion": "目标完成后的克制停手",
      "camera": {
        "shot_id": "S01",
        "transition": "continuous",
        "side": "南侧",
        "path": "连续双人全景，连续向后侧平移拉开，不切镜、不跳到另一侧",
        "axis_bridge": ""
      },
      "vfx": "无新增特效，只保留衣摆和浮尘变化",
      "environment": "落刀仍在原位，最后0.6秒尘土沉降",
      "sound": "脚步停止后只剩呼吸和轻微竹林风声。无台词与背景音乐。",
      "ability_ids": [],
      "before": {
        "A": "通路前停止攻击，右手木杖保持警戒，既有浅痕保留",
        "B": "北侧一膝触地，右手空，刀在身侧地面",
        "environment": "初始场景完整；远处石桥；道路北缘碎石带；第一次交接带起少量浮尘，双方仍在官道；A后退擦痕保留，B逐步靠近北缘碎石带；衣摆迟于身体回落，既有尘土继续飘动；B脚步进入碎石带，碎石因落脚滚动；短刀松手到落地轨迹可见，掉落点留在B身侧",
        "camera_side": "南侧"
      },
      "after": {
        "A": "通过阻挡后转身，右手木杖前端略放低，既有浅痕保留",
        "B": "北侧原位一膝触地，右手空",
        "environment": "初始场景完整；远处石桥；道路北缘碎石带；第一次交接带起少量浮尘，双方仍在官道；A后退擦痕保留，B逐步靠近北缘碎石带；衣摆迟于身体回落，既有尘土继续飘动；B脚步进入碎石带，碎石因落脚滚动；短刀松手到落地轨迹可见，掉落点留在B身侧；落刀仍在原位，最后0.6秒尘土沉降",
        "camera_side": "南侧"
      }
    }
  ],
  "sections": [
    {
      "id": "P01",
      "beat_ids": [
        "B01",
        "B02"
      ],